root@comp3134-Winter2025:~# tcpdump -i eth0
tcpdump: verbose output suppressed, use -v[v]... for full protocol decode
listening on eth0, link-type EN10MB (Ethernet), snapshot length 262144 bytes
22:48:07.278601 IP comp3134-Winter2025.ssh > pool-99-238-178-200.cpe.net.cable.rogers.com.64092: Flags [P.], seq 2629010365:2629010473, ack 2684190093, win 501, options [nop,nop,TS val 4197890809 ecr 1742081450], length 108
22:48:07.278661 IP comp3134-Winter2025.ssh > pool-99-238-178-200.cpe.net.cable.rogers.com.64092: Flags [P.], seq 108:144, ack 1, win 501, options [nop,nop,TS val 4197890809 ecr 1742081450], length 36
22:48:07.278692 IP comp3134-Winter2025.ssh > pool-99-238-178-200.cpe.net.cable.rogers.com.64092: Flags [P.], seq 144:196, ack 1, win 501, options [nop,nop,TS val 4197890809 ecr 1742081450], length 52
22:48:07.278725 IP comp3134-Winter2025.ssh > pool-99-238-178-200.cpe.net.cable.rogers.com.64092: Flags [P.], seq 196:264, ack 1, win 501, options [nop,nop,TS val 4197890809 ecr 1742081450], length 68
22:48:07.278757 IP comp3134-Winter2025.ssh > pool-99-238-178-200.cpe.net.cable.rogers.com.64092: Flags [P.], seq 264:332, ack 1, win 501, options [nop,nop,TS val 4197890809 ecr 1742081450], length 68
22:48:07.278845 IP comp3134-Winter2025.ssh > pool-99-238-178-200.cpe.net.cable.rogers.com.64092: Flags [P.], seq 332:368, ack 1, win 501, options [nop,nop,TS val 4197890810 ecr 1742081450], length 36
22:48:07.286957 IP pool-99-238-178-200.cpe.net.cable.rogers.com.64092 > comp3134-Winter2025.ssh: Flags [.], ack 0, win 2046, options [nop,nop,TS val 1742081471 ecr 4197890800], length 0
22:48:07.294784 IP pool-99-238-178-200.cpe.net.cable.rogers.com.64092 > comp3134-Winter2025.ssh: Flags [.], ack 368, win 2042, options [nop,nop,TS val 1742081481 ecr 4197890810], length 0
22:48:07.379640 IP comp3134-Winter2025.44727 > 67.207.67.3.domain: 17698+ [1au] PTR? 200.178.238.99.in-addr.arpa. (56)
22:48:07.379827 IP comp3134-Winter2025.55408 > 67.207.67.2.domain: Flags [S], seq 3743180291, win 64240, options [mss 1460,sackOK,TS val 2368181795 ecr 0,nop,wscale 7,tfo  cookiereq,nop,nop], length 0
22:48:07.380230 IP comp3134-Winter2025.60198 > 67.207.67.3.domain: 62179+ [1au] PTR? 182.39.227.165.in-addr.arpa. (56)
22:48:07.381706 IP 67.207.67.3.domain > comp3134-Winter2025.44727: 17698 1/0/1 PTR pool-99-238-178-200.cpe.net.cable.rogers.com. (114)
22:48:07.381781 IP 67.207.67.3.domain > comp3134-Winter2025.60198: 62179 NXDomain 0/1/1 (123)
22:48:07.381859 IP comp3134-Winter2025.60198 > 67.207.67.3.domain: 62179+ PTR? 182.39.227.165.in-addr.arpa. (45)
22:48:07.382355 IP 67.207.67.2.domain > comp3134-Winter2025.55408: Flags [S.], seq 805205658, ack 3743180292, win 65160, options [mss 1460,sackOK,TS val 856434869 ecr 2368181795,nop,wscale 9], length 0
22:48:07.382390 IP comp3134-Winter2025.55408 > 67.207.67.2.domain: Flags [.], ack 1, win 502, options [nop,nop,TS val 2368181797 ecr 856434869], length 0
22:48:07.382420 IP comp3134-Winter2025.55408 > 67.207.67.2.domain: Flags [P.], seq 1:48, ack 1, win 502, options [nop,nop,TS val 2368181797 ecr 856434869], length 47 28047+ PTR? 200.178.238.99.in-addr.arpa. (45)
22:48:07.383128 IP 67.207.67.3.domain > comp3134-Winter2025.60198: 62179 NXDomain 0/1/0 (112)
22:48:07.383576 IP 67.207.67.2.domain > comp3134-Winter2025.55408: Flags [.], ack 48, win 128, options [nop,nop,TS val 856434871 ecr 2368181797], length 0
22:48:07.383627 IP comp3134-Winter2025.ssh > pool-99-238-178-200.cpe.net.cable.rogers.com.64092: Flags [P.], seq 368:628, ack 1, win 501, options [nop,nop,TS val 4197890914 ecr 1742081481], length 260
22:48:07.383677 IP comp3134-Winter2025.ssh > pool-99-238-178-200.cpe.net.cable.rogers.com.64092: Flags [P.], seq 628:664, ack 1, win 501, options [nop,nop,TS val 4197890914 ecr 1742081481], length 36
22:48:07.383766 IP comp3134-Winter2025.ssh > pool-99-238-178-200.cpe.net.cable.rogers.com.64092: Flags [P.], seq 664:900, ack 1, win 501, options [nop,nop,TS val 4197890914 ecr 1742081481], length 236
22:48:07.383809 IP comp3134-Winter2025.ssh > pool-99-238-178-200.cpe.net.cable.rogers.com.64092: Flags [P.], seq 900:936, ack 1, win 501, options [nop,nop,TS val 4197890915 ecr 1742081481], length 36
22:48:07.383833 IP 67.207.67.2.domain > comp3134-Winter2025.55408: Flags [P.], seq 1:106, ack 48, win 128, options [nop,nop,TS val 856434871 ecr 2368181797], length 105 28047 1/0/0 PTR pool-99-238-178-200.cpe.net.cable.rogers.com. (103)
22:48:07.383843 IP comp3134-Winter2025.55408 > 67.207.67.2.domain: Flags [.], ack 106, win 502, options [nop,nop,TS val 2368181799 ecr 856434871], length 0
22:48:07.383955 IP comp3134-Winter2025.ssh > pool-99-238-178-200.cpe.net.cable.rogers.com.64092: Flags [P.], seq 936:1172, ack 1, win 501, options [nop,nop,TS val 4197890915 ecr 1742081481], length 236
22:48:07.383992 IP comp3134-Winter2025.ssh > pool-99-238-178-200.cpe.net.cable.rogers.com.64092: Flags [P.], seq 1172:1208, ack 1, win 501, options [nop,nop,TS val 4197890915 ecr 1742081481], length 36
22:48:07.384033 IP comp3134-Winter2025.ssh > pool-99-238-178-200.cpe.net.cable.rogers.com.64092: Flags [P.], seq 1208:1444, ack 1, win 501, options [nop,nop,TS val 4197890915 ecr 1742081481], length 236
22:48:07.384060 IP comp3134-Winter2025.ssh > pool-99-238-178-200.cpe.net.cable.rogers.com.64092: Flags [P.], seq 1444:1480, ack 1, win 501, options [nop,nop,TS val 4197890915 ecr 1742081481], length 36
22:48:07.384097 IP comp3134-Winter2025.ssh > pool-99-238-178-200.cpe.net.cable.rogers.com.64092: Flags [P.], seq 1480:1716, ack 1, win 501, options [nop,nop,TS val 4197890915 ecr 1742081481], length 236
22:48:07.384124 IP comp3134-Winter2025.ssh > pool-99-238-178-200.cpe.net.cable.rogers.com.64092: Flags [P.], seq 1716:1752, ack 1, win 501, options [nop,nop,TS val 4197890915 ecr 1742081481], length 36
22:48:07.384160 IP comp3134-Winter2025.ssh > pool-99-238-178-200.cpe.net.cable.rogers.com.64092: Flags [P.], seq 1752:1988, ack 1, win 501, options [nop,nop,TS val 4197890915 ecr 1742081481], length 236
22:48:07.384186 IP comp3134-Winter2025.ssh > pool-99-238-178-200.cpe.net.cable.rogers.com.64092: Flags [P.], seq 1988:2024, ack 1, win 501, options [nop,nop,TS val 4197890915 ecr 1742081481], length 36
22:48:07.399297 IP pool-99-238-178-200.cpe.net.cable.rogers.com.64092 > comp3134-Winter2025.ssh: Flags [.], ack 2024, win 2022, options [nop,nop,TS val 1742081587 ecr 4197890915], length 0
22:48:07.399362 IP comp3134-Winter2025.ssh > pool-99-238-178-200.cpe.net.cable.rogers.com.64092: Flags [P.], seq 2024:2544, ack 1, win 501, options [nop,nop,TS val 4197890930 ecr 1742081587], length 520
22:48:07.415386 IP pool-99-238-178-200.cpe.net.cable.rogers.com.64092 > comp3134-Winter2025.ssh: Flags [.], ack 2544, win 2039, options [nop,nop,TS val 1742081601 ecr 4197890930], length 0
22:48:07.483494 IP comp3134-Winter2025.54042 > 67.207.67.3.domain: 7476+ [1au] PTR? 3.67.207.67.in-addr.arpa. (53)
22:48:07.483597 IP comp3134-Winter2025.54906 > 67.207.67.3.domain: 116+ [1au] PTR? 3.67.207.67.in-addr.arpa. (53)
22:48:07.483639 IP comp3134-Winter2025.55408 > 67.207.67.2.domain: Flags [P.], seq 48:92, ack 106, win 502, options [nop,nop,TS val 2368181898 ecr 856434871], length 44 8957+ PTR? 3.67.207.67.in-addr.arpa. (42)
22:48:07.484660 IP 67.207.67.3.domain > comp3134-Winter2025.54906: 116 NXDomain 0/1/1 (120)
22:48:07.484817 IP comp3134-Winter2025.54906 > 67.207.67.3.domain: 116+ PTR? 3.67.207.67.in-addr.arpa. (42)
22:48:07.484837 IP 67.207.67.2.domain > comp3134-Winter2025.55408: Flags [P.], seq 106:217, ack 92, win 128, options [nop,nop,TS val 856434972 ecr 2368181898], length 111 8957 NXDomain 0/1/0 (109)
22:48:07.484867 IP comp3134-Winter2025.55408 > 67.207.67.2.domain: Flags [.], ack 217, win 502, options [nop,nop,TS val 2368181900 ecr 856434972], length 0
22:48:07.484906 IP 67.207.67.3.domain > comp3134-Winter2025.54042: 7476 NXDomain 0/1/1 (120)
22:48:07.485079 IP comp3134-Winter2025.54042 > 67.207.67.3.domain: 7476+ PTR? 3.67.207.67.in-addr.arpa. (42)
22:48:07.485972 IP 67.207.67.3.domain > comp3134-Winter2025.54906: 116 NXDomain 0/1/0 (109)
22:48:07.486280 IP 67.207.67.3.domain > comp3134-Winter2025.54042: 7476 NXDomain 0/1/0 (109)
22:48:07.486835 IP comp3134-Winter2025.ssh > pool-99-238-178-200.cpe.net.cable.rogers.com.64092: Flags [P.], seq 2544:2700, ack 1, win 501, options [nop,nop,TS val 4197891018 ecr 1742081601], length 156
22:48:07.486901 IP comp3134-Winter2025.ssh > pool-99-238-178-200.cpe.net.cable.rogers.com.64092: Flags [P.], seq 2700:2736, ack 1, win 501, options [nop,nop,TS val 4197891018 ecr 1742081601], length 36
22:48:07.487342 IP comp3134-Winter2025.51083 > 67.207.67.3.domain: 62880+ [1au] PTR? 2.67.207.67.in-addr.arpa. (53)
22:48:07.487457 IP comp3134-Winter2025.55658 > 67.207.67.3.domain: 64169+ [1au] PTR? 2.67.207.67.in-addr.arpa. (53)
22:48:07.487493 IP comp3134-Winter2025.55408 > 67.207.67.2.domain: Flags [P.], seq 92:136, ack 217, win 502, options [nop,nop,TS val 2368181902 ecr 856434972], length 44 63305+ PTR? 2.67.207.67.in-addr.arpa. (42)
22:48:07.488439 IP 67.207.67.3.domain > comp3134-Winter2025.51083: 62880 NXDomain 0/1/1 (120)
22:48:07.488440 IP 67.207.67.3.domain > comp3134-Winter2025.55658: 64169 NXDomain 0/1/1 (120)
22:48:07.488633 IP comp3134-Winter2025.51083 > 67.207.67.3.domain: 62880+ PTR? 2.67.207.67.in-addr.arpa. (42)
22:48:07.488692 IP comp3134-Winter2025.55658 > 67.207.67.3.domain: 64169+ PTR? 2.67.207.67.in-addr.arpa. (42)
22:48:07.488781 IP 67.207.67.2.domain > comp3134-Winter2025.55408: Flags [P.], seq 217:328, ack 136, win 128, options [nop,nop,TS val 856434976 ecr 2368181902], length 111 63305 NXDomain 0/1/0 (109)
22:48:07.489707 IP 67.207.67.3.domain > comp3134-Winter2025.55658: 64169 NXDomain 0/1/0 (109)
22:48:07.489707 IP 67.207.67.3.domain > comp3134-Winter2025.51083: 62880 NXDomain 0/1/0 (109)
22:48:07.490184 IP comp3134-Winter2025.ssh > pool-99-238-178-200.cpe.net.cable.rogers.com.64092: Flags [P.], seq 2736:2972, ack 1, win 501, options [nop,nop,TS val 4197891021 ecr 1742081601], length 236
22:48:07.490387 IP comp3134-Winter2025.ssh > pool-99-238-178-200.cpe.net.cable.rogers.com.64092: Flags [P.], seq 2972:3008, ack 1, win 501, options [nop,nop,TS val 4197891021 ecr 1742081601], length 36
22:48:07.490480 IP comp3134-Winter2025.ssh > pool-99-238-178-200.cpe.net.cable.rogers.com.64092: Flags [P.], seq 3008:3164, ack 1, win 501, options [nop,nop,TS val 4197891021 ecr 1742081601], length 156
22:48:07.490508 IP comp3134-Winter2025.ssh > pool-99-238-178-200.cpe.net.cable.rogers.com.64092: Flags [P.], seq 3164:3200, ack 1, win 501, options [nop,nop,TS val 4197891021 ecr 1742081601], length 36
22:48:07.490550 IP comp3134-Winter2025.ssh > pool-99-238-178-200.cpe.net.cable.rogers.com.64092: Flags [P.], seq 3200:3372, ack 1, win 501, options [nop,nop,TS val 4197891021 ecr 1742081601], length 172
22:48:07.490577 IP comp3134-Winter2025.ssh > pool-99-238-178-200.cpe.net.cable.rogers.com.64092: Flags [P.], seq 3372:3408, ack 1, win 501, options [nop,nop,TS val 4197891021 ecr 1742081601], length 36
22:48:07.490611 IP comp3134-Winter2025.ssh > pool-99-238-178-200.cpe.net.cable.rogers.com.64092: Flags [P.], seq 3408:3540, ack 1, win 501, options [nop,nop,TS val 4197891021 ecr 1742081601], length 132
22:48:07.490637 IP comp3134-Winter2025.ssh > pool-99-238-178-200.cpe.net.cable.rogers.com.64092: Flags [P.], seq 3540:3576, ack 1, win 501, options [nop,nop,TS val 4197891021 ecr 1742081601], length 36
22:48:07.490673 IP comp3134-Winter2025.ssh > pool-99-238-178-200.cpe.net.cable.rogers.com.64092: Flags [P.], seq 3576:3724, ack 1, win 501, options [nop,nop,TS val 4197891021 ecr 1742081601], length 148
22:48:07.490699 IP comp3134-Winter2025.ssh > pool-99-238-178-200.cpe.net.cable.rogers.com.64092: Flags [P.], seq 3724:3760, ack 1, win 501, options [nop,nop,TS val 4197891021 ecr 1742081601], length 36
22:48:07.490759 IP comp3134-Winter2025.ssh > pool-99-238-178-200.cpe.net.cable.rogers.com.64092: Flags [P.], seq 3760:3996, ack 1, win 501, options [nop,nop,TS val 4197891021 ecr 1742081601], length 236
22:48:07.490821 IP comp3134-Winter2025.ssh > pool-99-238-178-200.cpe.net.cable.rogers.com.64092: Flags [P.], seq 3996:4032, ack 1, win 501, options [nop,nop,TS val 4197891022 ecr 1742081601], length 36
22:48:07.501897 IP pool-99-238-178-200.cpe.net.cable.rogers.com.64092 > comp3134-Winter2025.ssh: Flags [.], ack 2736, win 2045, options [nop,nop,TS val 1742081688 ecr 4197891018], length 0
22:48:07.501978 IP comp3134-Winter2025.ssh > pool-99-238-178-200.cpe.net.cable.rogers.com.64092: Flags [P.], seq 4032:6928, ack 1, win 501, options [nop,nop,TS val 4197891033 ecr 1742081688], length 2896
22:48:07.508564 IP pool-99-238-178-200.cpe.net.cable.rogers.com.64092 > comp3134-Winter2025.ssh: Flags [.], ack 4032, win 2027, options [nop,nop,TS val 1742081693 ecr 4197891022], length 0
22:48:07.508638 IP comp3134-Winter2025.ssh > pool-99-238-178-200.cpe.net.cable.rogers.com.64092: Flags [P.], seq 6928:9544, ack 1, win 501, options [nop,nop,TS val 4197891039 ecr 1742081693], length 2616
22:48:07.516611 IP pool-99-238-178-200.cpe.net.cable.rogers.com.64092 > comp3134-Winter2025.ssh: Flags [.], ack 6928, win 2048, options [nop,nop,TS val 1742081704 ecr 4197891033], length 0
22:48:07.523334 IP pool-99-238-178-200.cpe.net.cable.rogers.com.64092 > comp3134-Winter2025.ssh: Flags [.], ack 9544, win 2007, options [nop,nop,TS val 1742081710 ecr 4197891039], length 0
22:48:07.530816 IP comp3134-Winter2025.55408 > 67.207.67.2.domain: Flags [.], ack 328, win 502, options [nop,nop,TS val 2368181946 ecr 856434976], length 0
^C
78 packets captured
101 packets received by filter
0 packets dropped by kernel


