root@comp3134-Winter2025:~# tcpdump -i eth0 dst 165.227.39.182
tcpdump: verbose output suppressed, use -v[v]... for full protocol decode
listening on eth0, link-type EN10MB (Ethernet), snapshot length 262144 bytes
00:43:43.063589 IP pool-99-238-178-200.cpe.net.cable.rogers.com.64092 > comp3134-Winter2025.ssh: Flags [.], ack 2629359457, win 2045, options [nop,nop,TS val 1749017387 ecr 4204826578], length 0
00:43:43.070662 IP pool-99-238-178-200.cpe.net.cable.rogers.com.64092 > comp3134-Winter2025.ssh: Flags [.], ack 369, win 2042, options [nop,nop,TS val 1749017396 ecr 4204826585], length 0
00:43:43.158122 IP 67.207.67.3.domain > comp3134-Winter2025.59178: 5044 NXDomain 0/1/1 (123)
00:43:43.159680 IP 67.207.67.3.domain > comp3134-Winter2025.59178: 5044 NXDomain 0/1/0 (112)
00:43:43.162857 IP 67.207.67.3.domain > comp3134-Winter2025.49660: 56322 1/0/1 PTR pool-99-238-178-200.cpe.net.cable.rogers.com. (114)
00:43:43.182336 IP pool-99-238-178-200.cpe.net.cable.rogers.com.64092 > comp3134-Winter2025.ssh: Flags [.], ack 897, win 2039, options [nop,nop,TS val 1749017503 ecr 4204826693], length 0
00:43:43.277584 IP 67.207.67.3.domain > comp3134-Winter2025.55922: 43210 NXDomain 0/1/1 (120)
00:43:43.278091 IP 67.207.67.3.domain > comp3134-Winter2025.37831: 49338 NXDomain 0/1/1 (120)
00:43:43.279528 IP 67.207.67.3.domain > comp3134-Winter2025.55922: 43210 NXDomain 0/1/0 (109)
00:43:43.279665 IP 67.207.67.3.domain > comp3134-Winter2025.37831: 49338 NXDomain 0/1/0 (109)
00:43:45.515612 IP nksisha.click.41272 > comp3134-Winter2025.3308: Flags [S], seq 1529348666, win 1025, options [mss 1460], length 0
00:43:46.225426 IP 67.207.67.3.domain > comp3134-Winter2025.56126: Flags [S.], seq 1013637777, ack 1395568036, win 65160, options [mss 1460,sackOK,TS val 1098589302 ecr 955361994,nop,wscale 9], length 0
00:43:46.226708 IP 67.207.67.3.domain > comp3134-Winter2025.56126: Flags [.], ack 45, win 128, options [nop,nop,TS val 1098589303 ecr 955361996], length 0
00:43:46.227149 IP 67.207.67.3.domain > comp3134-Winter2025.56126: Flags [P.], seq 1:112, ack 45, win 128, options [nop,nop,TS val 1098589304 ecr 955361996], length 111 50371 NXDomain 0/1/0 (109)
00:43:46.271628 IP 67.207.67.3.domain > comp3134-Winter2025.56126: Flags [.], ack 91, win 128, options [nop,nop,TS val 1098589348 ecr 955361999], length 0
00:43:46.310590 IP pool-99-238-178-200.cpe.net.cable.rogers.com.64092 > comp3134-Winter2025.ssh: Flags [.], ack 1829, win 2033, options [nop,nop,TS val 1749020631 ecr 4204829759], length 0
00:43:46.509304 IP 67.207.67.3.domain > comp3134-Winter2025.35136: 17037 1/0/1 PTR nksisha.click. (82)
00:43:46.509305 IP 67.207.67.3.domain > comp3134-Winter2025.57886: 42956 1/0/1 PTR nksisha.click. (82)
00:43:46.510873 IP 67.207.67.3.domain > comp3134-Winter2025.56126: Flags [P.], seq 112:185, ack 91, win 128, options [nop,nop,TS val 1098589588 ecr 955361999], length 73 2847 1/0/0 PTR nksisha.click. (71)
00:43:46.525366 IP pool-99-238-178-200.cpe.net.cable.rogers.com.64092 > comp3134-Winter2025.ssh: Flags [.], ack 2905, win 2031, options [nop,nop,TS val 1749020850 ecr 4204830041], length 0
00:43:46.604262 IP pool-99-238-178-200.cpe.net.cable.rogers.com.64092 > comp3134-Winter2025.ssh: Flags [.], ack 3549, win 2037, options [nop,nop,TS val 1749020927 ecr 4204830118], length 0
00:43:46.707814 IP pool-99-238-178-200.cpe.net.cable.rogers.com.64092 > comp3134-Winter2025.ssh: Flags [.], ack 3777, win 2044, options [nop,nop,TS val 1749021031 ecr 4204830222], length 0
00:43:46.811838 IP pool-99-238-178-200.cpe.net.cable.rogers.com.64092 > comp3134-Winter2025.ssh: Flags [.], ack 4005, win 2044, options [nop,nop,TS val 1749021135 ecr 4204830326], length 0
00:43:46.914143 IP pool-99-238-178-200.cpe.net.cable.rogers.com.64092 > comp3134-Winter2025.ssh: Flags [.], ack 4233, win 2044, options [nop,nop,TS val 1749021239 ecr 4204830430], length 0
00:43:47.018057 IP pool-99-238-178-200.cpe.net.cable.rogers.com.64092 > comp3134-Winter2025.ssh: Flags [.], ack 4461, win 2044, options [nop,nop,TS val 1749021343 ecr 4204830534], length 0
00:43:47.123910 IP pool-99-238-178-200.cpe.net.cable.rogers.com.64092 > comp3134-Winter2025.ssh: Flags [.], ack 4689, win 2044, options [nop,nop,TS val 1749021447 ecr 4204830638], length 0
00:43:47.225818 IP pool-99-238-178-200.cpe.net.cable.rogers.com.64092 > comp3134-Winter2025.ssh: Flags [.], ack 4917, win 2044, options [nop,nop,TS val 1749021551 ecr 4204830742], length 0
00:43:47.329887 IP pool-99-238-178-200.cpe.net.cable.rogers.com.64092 > comp3134-Winter2025.ssh: Flags [.], ack 5145, win 2044, options [nop,nop,TS val 1749021655 ecr 4204830846], length 0
00:43:47.436534 IP pool-99-238-178-200.cpe.net.cable.rogers.com.64092 > comp3134-Winter2025.ssh: Flags [.], ack 5373, win 2044, options [nop,nop,TS val 1749021759 ecr 4204830950], length 0
00:43:47.538268 IP pool-99-238-178-200.cpe.net.cable.rogers.com.64092 > comp3134-Winter2025.ssh: Flags [.], ack 5601, win 2044, options [nop,nop,TS val 1749021862 ecr 4204831054], length 0
^C
30 packets captured
31 packets received by filter
0 packets dropped by kernel

