root@comp3134-Winter2025:~# tcpdump -n -i eth0
tcpdump: verbose output suppressed, use -v[v]... for full protocol decode
listening on eth0, link-type EN10MB (Ethernet), snapshot length 262144 bytes
00:01:37.404423 IP 165.227.39.182.22 > 99.238.178.200.64092: Flags [P.], seq 2629075497:2629075605, ack 2684193865, win 501, options [nop,nop,TS val 4202300935 ecr 1746491674], length 108
00:01:37.404505 IP 165.227.39.182.22 > 99.238.178.200.64092: Flags [P.], seq 108:144, ack 1, win 501, options [nop,nop,TS val 4202300935 ecr 1746491674], length 36
00:01:37.404548 IP 165.227.39.182.22 > 99.238.178.200.64092: Flags [P.], seq 144:196, ack 1, win 501, options [nop,nop,TS val 4202300935 ecr 1746491674], length 52
00:01:37.404591 IP 165.227.39.182.22 > 99.238.178.200.64092: Flags [P.], seq 196:264, ack 1, win 501, options [nop,nop,TS val 4202300935 ecr 1746491674], length 68
00:01:37.404654 IP 165.227.39.182.22 > 99.238.178.200.64092: Flags [P.], seq 264:368, ack 1, win 501, options [nop,nop,TS val 4202300935 ecr 1746491674], length 104
00:01:37.416379 IP 99.238.178.200.64092 > 165.227.39.182.22: Flags [.], ack 368, win 2042, options [nop,nop,TS val 1746491697 ecr 4202300935], length 0
00:01:37.503285 IP 165.227.39.182.22 > 99.238.178.200.64092: Flags [P.], seq 368:596, ack 1, win 501, options [nop,nop,TS val 4202301034 ecr 1746491697], length 228
00:01:37.503365 IP 165.227.39.182.22 > 99.238.178.200.64092: Flags [P.], seq 596:836, ack 1, win 501, options [nop,nop,TS val 4202301034 ecr 1746491697], length 240
00:01:37.503412 IP 165.227.39.182.22 > 99.238.178.200.64092: Flags [P.], seq 836:872, ack 1, win 501, options [nop,nop,TS val 4202301034 ecr 1746491697], length 36
00:01:37.503445 IP 165.227.39.182.22 > 99.238.178.200.64092: Flags [P.], seq 872:1076, ack 1, win 501, options [nop,nop,TS val 4202301034 ecr 1746491697], length 204
